"film_id","title","description","release_year","language_id","rental_duration","rental_rate","length","replacement_cost","rating","last_update","special_features","fulltext"
423,"Hollywood Anonymous","A Fast-Paced Epistle of a Boy And a Explorer who must Escape a Dog in A U-Boat",2006,1,7,"0.99",69,"29.99","PG","2013-05-26 14:50:58.951","{Trailers,""Behind the Scenes""}","'anonym':2 'boat':23 'boy':10 'dog':18 'epistl':7 'escap':16 'explor':13 'fast':5 'fast-pac':4 'hollywood':1 'must':15 'pace':6 'u':22 'u-boat':21"
425,"Holy Tadpole","A Action-Packed Display of a Feminist And a Pioneer who must Pursue a Dog in A Baloon Factory",2006,1,6,"0.99",88,"20.99","R","2013-05-26 14:50:58.951","{""Behind the Scenes""}","'action':5 'action-pack':4 'baloon':21 'display':7 'dog':18 'factori':22 'feminist':10 'holi':1 'must':15 'pack':6 'pioneer':13 'pursu':16 'tadpol':2"
428,"Homicide Peach","A Astounding Documentary of a Hunter And a Boy who must Confront a Boy in A MySQL Convention",2006,1,6,"2.99",141,"21.99","PG-13","2013-05-26 14:50:58.951","{Commentaries}","'astound':4 'boy':11,16 'confront':14 'convent':20 'documentari':5 'homicid':1 'hunter':8 'must':13 'mysql':19 'peach':2"
429,"Honey Ties","A Taut Story of a Waitress And a Crocodile who must Outrace a Lumberjack in A Shark Tank",2006,1,3,"0.99",84,"29.99","R","2013-05-26 14:50:58.951","{Trailers,Commentaries,""Deleted Scenes""}","'crocodil':11 'honey':1 'lumberjack':16 'must':13 'outrac':14 'shark':19 'stori':5 'tank':20 'taut':4 'tie':2 'waitress':8"
430,"Hook Chariots","A Insightful Story of a Boy And a Dog who must Redeem a Boy in Australia",2006,1,7,"0.99",49,"23.99","G","2013-05-26 14:50:58.951","{Trailers,Commentaries,""Behind the Scenes""}","'australia':18 'boy':8,16 'chariot':2 'dog':11 'hook':1 'insight':4 'must':13 'redeem':14 'stori':5"
450,"Idols Snatchers","A Insightful Drama of a Car And a Composer who must Fight a Man in A Monastery",2006,1,5,"2.99",84,"29.99","NC-17","2013-05-26 14:50:58.951","{Trailers}","'car':8 'compos':11 'drama':5 'fight':14 'idol':1 'insight':4 'man':16 'monasteri':19 'must':13 'snatcher':2"
432,"Hope Tootsie","A Amazing Documentary of a Student And a Sumo Wrestler who must Outgun a A Shark in A Shark Tank",2006,1,4,"2.99",139,"22.99","NC-17","2013-05-26 14:50:58.951","{Trailers,""Deleted Scenes"",""Behind the Scenes""}","'amaz':4 'documentari':5 'hope':1 'must':14 'outgun':15 'shark':18,21 'student':8 'sumo':11 'tank':22 'tootsi':2 'wrestler':12"
433,"Horn Working","A Stunning Display of a Mad Scientist And a Technical Writer who must Succumb a Monkey in A Shark Tank",2006,1,4,"2.99",95,"23.99","PG","2013-05-26 14:50:58.951","{Trailers}","'display':5 'horn':1 'mad':8 'monkey':18 'must':15 'scientist':9 'shark':21 'stun':4 'succumb':16 'tank':22 'technic':12 'work':2 'writer':13"
434,"Horror Reign","A Touching Documentary of a A Shark And a Car who must Build a Husband in Nigeria",2006,1,3,"0.99",139,"25.99","R","2013-05-26 14:50:58.951","{""Deleted Scenes"",""Behind the Scenes""}","'build':15 'car':12 'documentari':5 'horror':1 'husband':17 'must':14 'nigeria':19 'reign':2 'shark':9 'touch':4"
435,"Hotel Happiness","A Thrilling Yarn of a Pastry Chef And a A Shark who must Challenge a Mad Scientist in The Outback",2006,1,6,"4.99",181,"28.99","PG-13","2013-05-26 14:50:58.951","{""Behind the Scenes""}","'challeng':16 'chef':9 'happi':2 'hotel':1 'mad':18 'must':15 'outback':22 'pastri':8 'scientist':19 'shark':13 'thrill':4 'yarn':5"
438,"Human Graffiti","A Beautiful Reflection of a Womanizer And a Sumo Wrestler who must Chase a Database Administrator in The Gulf of Mexico",2006,1,3,"2.99",68,"22.99","NC-17","2013-05-26 14:50:58.951","{Trailers,""Behind the Scenes""}","'administr':18 'beauti':4 'chase':15 'databas':17 'graffiti':2 'gulf':21 'human':1 'mexico':23 'must':14 'reflect':5 'sumo':11 'woman':8 'wrestler':12"
439,"Hunchback Impossible","A Touching Yarn of a Frisbee And a Dentist who must Fight a Composer in Ancient Japan",2006,1,4,"4.99",151,"28.99","PG-13","2013-05-26 14:50:58.951","{Trailers,""Deleted Scenes""}","'ancient':18 'compos':16 'dentist':11 'fight':14 'frisbe':8 'hunchback':1 'imposs':2 'japan':19 'must':13 'touch':4 'yarn':5"
440,"Hunger Roof","A Unbelieveable Yarn of a Student And a Database Administrator who must Outgun a Husband in An Abandoned Mine Shaft",2006,1,6,"0.99",105,"21.99","G","2013-05-26 14:50:58.951","{""Deleted Scenes"",""Behind the Scenes""}","'abandon':20 'administr':12 'databas':11 'hunger':1 'husband':17 'mine':21 'must':14 'outgun':15 'roof':2 'shaft':22 'student':8 'unbeliev':4 'yarn':5"
441,"Hunter Alter","A Emotional Drama of a Mad Cow And a Boat who must Redeem a Secret Agent in A Shark Tank",2006,1,5,"2.99",125,"21.99","PG-13","2013-05-26 14:50:58.951","{Commentaries,""Deleted Scenes"",""Behind the Scenes""}","'agent':18 'alter':2 'boat':12 'cow':9 'drama':5 'emot':4 'hunter':1 'mad':8 'must':14 'redeem':15 'secret':17 'shark':21 'tank':22"
442,"Hunting Musketeers","A Thrilling Reflection of a Pioneer And a Dentist who must Outrace a Womanizer in An Abandoned Mine Shaft",2006,1,6,"2.99",65,"24.99","NC-17","2013-05-26 14:50:58.951","{Trailers,""Deleted Scenes""}","'abandon':19 'dentist':11 'hunt':1 'mine':20 'musket':2 'must':13 'outrac':14 'pioneer':8 'reflect':5 'shaft':21 'thrill':4 'woman':16"
444,"Hustler Party","A Emotional Reflection of a Sumo Wrestler And a Monkey who must Conquer a Robot in The Sahara Desert",2006,1,3,"4.99",83,"22.99","NC-17","2013-05-26 14:50:58.951","{Trailers,Commentaries,""Behind the Scenes""}","'conquer':15 'desert':21 'emot':4 'hustler':1 'monkey':12 'must':14 'parti':2 'reflect':5 'robot':17 'sahara':20 'sumo':8 'wrestler':9"
447,"Ice Crossing","A Fast-Paced Tale of a Butler And a Moose who must Overcome a Pioneer in A Manhattan Penthouse",2006,1,5,"2.99",131,"28.99","R","2013-05-26 14:50:58.951","{""Deleted Scenes""}","'butler':10 'cross':2 'fast':5 'fast-pac':4 'ice':1 'manhattan':21 'moos':13 'must':15 'overcom':16 'pace':6 'penthous':22 'pioneer':18 'tale':7"
448,"Idaho Love","A Fast-Paced Drama of a Student And a Crocodile who must Meet a Database Administrator in The Outback",2006,1,3,"2.99",172,"25.99","PG-13","2013-05-26 14:50:58.951","{Trailers,Commentaries,""Deleted Scenes"",""Behind the Scenes""}","'administr':19 'crocodil':13 'databas':18 'drama':7 'fast':5 'fast-pac':4 'idaho':1 'love':2 'meet':16 'must':15 'outback':22 'pace':6 'student':10"
454,"Impact Aladdin","A Epic Character Study of a Frisbee And a Moose who must Outgun a Technical Writer in A Shark Tank",2006,1,6,"0.99",180,"20.99","PG-13","2013-05-26 14:50:58.951","{Trailers,""Deleted Scenes""}","'aladdin':2 'charact':5 'epic':4 'frisbe':9 'impact':1 'moos':12 'must':14 'outgun':15 'shark':21 'studi':6 'tank':22 'technic':17 'writer':18"
457,"Independence Hotel","A Thrilling Tale of a Technical Writer And a Boy who must Face a Pioneer in A Monastery",2006,1,5,"0.99",157,"21.99","NC-17","2013-05-26 14:50:58.951","{Trailers,""Behind the Scenes""}","'boy':12 'face':15 'hotel':2 'independ':1 'monasteri':20 'must':14 'pioneer':17 'tale':5 'technic':8 'thrill':4 'writer':9"
458,"Indian Love","A Insightful Saga of a Mad Scientist And a Mad Scientist who must Kill a Astronaut in An Abandoned Fun House",2006,1,4,"0.99",135,"26.99","NC-17","2013-05-26 14:50:58.951","{Trailers,Commentaries,""Deleted Scenes"",""Behind the Scenes""}","'abandon':21 'astronaut':18 'fun':22 'hous':23 'indian':1 'insight':4 'kill':16 'love':2 'mad':8,12 'must':15 'saga':5 'scientist':9,13"
459,"Informer Double","A Action-Packed Display of a Woman And a Dentist who must Redeem a Forensic Psychologist in The Canadian Rockies",2006,1,4,"4.99",74,"23.99","NC-17","2013-05-26 14:50:58.951","{Trailers,Commentaries}","'action':5 'action-pack':4 'canadian':22 'dentist':13 'display':7 'doubl':2 'forens':18 'inform':1 'must':15 'pack':6 'psychologist':19 'redeem':16 'rocki':23 'woman':10"
460,"Innocent Usual","A Beautiful Drama of a Pioneer And a Crocodile who must Challenge a Student in The Outback",2006,1,3,"4.99",178,"26.99","PG-13","2013-05-26 14:50:58.951","{Trailers,""Deleted Scenes"",""Behind the Scenes""}","'beauti':4 'challeng':14 'crocodil':11 'drama':5 'innoc':1 'must':13 'outback':19 'pioneer':8 'student':16 'usual':2"
463,"Instinct Airport","A Touching Documentary of a Mad Cow And a Explorer who must Confront a Butler in A Manhattan Penthouse",2006,1,4,"2.99",116,"21.99","PG","2013-05-26 14:50:58.951","{Commentaries,""Deleted Scenes""}","'airport':2 'butler':17 'confront':15 'cow':9 'documentari':5 'explor':12 'instinct':1 'mad':8 'manhattan':20 'must':14 'penthous':21 'touch':4"
466,"Intolerable Intentions","A Awe-Inspiring Story of a Monkey And a Pastry Chef who must Succumb a Womanizer in A MySQL Convention",2006,1,6,"4.99",63,"20.99","PG-13","2013-05-26 14:50:58.951","{Commentaries,""Behind the Scenes""}","'awe':5 'awe-inspir':4 'chef':14 'convent':23 'inspir':6 'intent':2 'intoler':1 'monkey':10 'must':16 'mysql':22 'pastri':13 'stori':7 'succumb':17 'woman':19"
469,"Iron Moon","A Fast-Paced Documentary of a Mad Cow And a Boy who must Pursue a Dentist in A Baloon",2006,1,7,"4.99",46,"27.99","PG","2013-05-26 14:50:58.951","{Commentaries,""Behind the Scenes""}","'baloon':22 'boy':14 'cow':11 'dentist':19 'documentari':7 'fast':5 'fast-pac':4 'iron':1 'mad':10 'moon':2 'must':16 'pace':6 'pursu':17"
470,"Ishtar Rocketeer","A Astounding Saga of a Dog And a Squirrel who must Conquer a Dog in An Abandoned Fun House",2006,1,4,"4.99",79,"24.99","R","2013-05-26 14:50:58.951","{Trailers,Commentaries,""Deleted Scenes""}","'abandon':19 'astound':4 'conquer':14 'dog':8,16 'fun':20 'hous':21 'ishtar':1 'must':13 'rocket':2 'saga':5 'squirrel':11"
471,"Island Exorcist","A Fanciful Panorama of a Technical Writer And a Boy who must Find a Dentist in An Abandoned Fun House",2006,1,7,"2.99",84,"23.99","NC-17","2013-05-26 14:50:58.951","{Trailers,Commentaries}","'abandon':20 'boy':12 'dentist':17 'exorcist':2 'fanci':4 'find':15 'fun':21 'hous':22 'island':1 'must':14 'panorama':5 'technic':8 'writer':9"
472,"Italian African","A Astounding Character Study of a Monkey And a Moose who must Outgun a Cat in A U-Boat",2006,1,3,"4.99",174,"24.99","G","2013-05-26 14:50:58.951","{Trailers,Commentaries,""Deleted Scenes""}","'african':2 'astound':4 'boat':22 'cat':17 'charact':5 'italian':1 'monkey':9 'moos':12 'must':14 'outgun':15 'studi':6 'u':21 'u-boat':20"
474,"Jade Bunch","A Insightful Panorama of a Squirrel And a Mad Cow who must Confront a Student in The First Manned Space Station",2006,1,6,"2.99",174,"21.99","NC-17","2013-05-26 14:50:58.951","{Trailers,Commentaries,""Behind the Scenes""}","'bunch':2 'confront':15 'cow':12 'first':20 'insight':4 'jade':1 'mad':11 'man':21 'must':14 'panorama':5 'space':22 'squirrel':8 'station':23 'student':17"
475,"Japanese Run","A Awe-Inspiring Epistle of a Feminist And a Girl who must Sink a Girl in The Outback",2006,1,6,"0.99",135,"29.99","G","2013-05-26 14:50:58.951","{""Deleted Scenes""}","'awe':5 'awe-inspir':4 'epistl':7 'feminist':10 'girl':13,18 'inspir':6 'japanes':1 'must':15 'outback':21 'run':2 'sink':16"
480,"Jeepers Wedding","A Astounding Display of a Composer And a Dog who must Kill a Pastry Chef in Soviet Georgia",2006,1,3,"2.99",84,"29.99","R","2013-05-26 14:50:58.951","{Trailers,Commentaries,""Deleted Scenes""}","'astound':4 'chef':17 'compos':8 'display':5 'dog':11 'georgia':20 'jeeper':1 'kill':14 'must':13 'pastri':16 'soviet':19 'wed':2"
481,"Jekyll Frogmen","A Fanciful Epistle of a Student And a Astronaut who must Kill a Waitress in A Shark Tank",2006,1,4,"2.99",58,"22.99","PG","2013-05-26 14:50:58.951","{Commentaries,""Deleted Scenes"",""Behind the Scenes""}","'astronaut':11 'epistl':5 'fanci':4 'frogmen':2 'jekyl':1 'kill':14 'must':13 'shark':19 'student':8 'tank':20 'waitress':16"
483,"Jericho Mulan","A Amazing Yarn of a Hunter And a Butler who must Defeat a Boy in A Jet Boat",2006,1,3,"2.99",171,"29.99","NC-17","2013-05-26 14:50:58.951","{Commentaries}","'amaz':4 'boat':20 'boy':16 'butler':11 'defeat':14 'hunter':8 'jericho':1 'jet':19 'mulan':2 'must':13 'yarn':5"
487,"Jingle Sagebrush","A Epic Character Study of a Feminist And a Student who must Meet a Woman in A Baloon",2006,1,6,"4.99",124,"29.99","PG-13","2013-05-26 14:50:58.951","{Trailers,Commentaries}","'baloon':20 'charact':5 'epic':4 'feminist':9 'jingl':1 'meet':15 'must':14 'sagebrush':2 'student':12 'studi':6 'woman':17"
488,"Joon Northwest","A Thrilling Panorama of a Technical Writer And a Car who must Discover a Forensic Psychologist in A Shark Tank",2006,1,3,"0.99",105,"23.99","NC-17","2013-05-26 14:50:58.951","{Trailers,Commentaries,""Behind the Scenes""}","'car':12 'discov':15 'forens':17 'joon':1 'must':14 'northwest':2 'panorama':5 'psychologist':18 'shark':21 'tank':22 'technic':8 'thrill':4 'writer':9"
494,"Karate Moon","A Astounding Yarn of a Womanizer And a Dog who must Reach a Waitress in A MySQL Convention",2006,1,4,"0.99",120,"21.99","PG-13","2013-05-26 14:50:58.951","{""Behind the Scenes""}","'astound':4 'convent':20 'dog':11 'karat':1 'moon':2 'must':13 'mysql':19 'reach':14 'waitress':16 'woman':8 'yarn':5"
499,"King Evolution","A Action-Packed Tale of a Boy And a Lumberjack who must Chase a Madman in A Baloon",2006,1,3,"4.99",184,"24.99","NC-17","2013-05-26 14:50:58.951","{Trailers,""Deleted Scenes"",""Behind the Scenes""}","'action':5 'action-pack':4 'baloon':21 'boy':10 'chase':16 'evolut':2 'king':1 'lumberjack':13 'madman':18 'must':15 'pack':6 'tale':7"
502,"Knock Warlock","A Unbelieveable Story of a Teacher And a Boat who must Confront a Moose in A Baloon",2006,1,4,"2.99",71,"21.99","PG-13","2013-05-26 14:50:58.951","{Trailers}","'baloon':19 'boat':11 'confront':14 'knock':1 'moos':16 'must':13 'stori':5 'teacher':8 'unbeliev':4 'warlock':2"
503,"Kramer Chocolate","A Amazing Yarn of a Robot And a Pastry Chef who must Redeem a Mad Scientist in The Outback",2006,1,3,"2.99",171,"24.99","R","2013-05-26 14:50:58.951","{Trailers}","'amaz':4 'chef':12 'chocol':2 'kramer':1 'mad':17 'must':14 'outback':21 'pastri':11 'redeem':15 'robot':8 'scientist':18 'yarn':5"
504,"Kwai Homeward","A Amazing Drama of a Car And a Squirrel who must Pursue a Car in Soviet Georgia",2006,1,5,"0.99",46,"25.99","PG-13","2013-05-26 14:50:58.951","{Trailers,Commentaries}","'amaz':4 'car':8,16 'drama':5 'georgia':19 'homeward':2 'kwai':1 'must':13 'pursu':14 'soviet':18 'squirrel':11"
505,"Labyrinth League","A Awe-Inspiring Saga of a Composer And a Frisbee who must Succumb a Pioneer in The Sahara Desert",2006,1,6,"2.99",46,"24.99","PG-13","2013-05-26 14:50:58.951","{Commentaries,""Behind the Scenes""}","'awe':5 'awe-inspir':4 'compos':10 'desert':22 'frisbe':13 'inspir':6 'labyrinth':1 'leagu':2 'must':15 'pioneer':18 'saga':7 'sahara':21 'succumb':16"
753,"Rush Goodfellas","A Emotional Display of a Man And a Dentist who must Challenge a Squirrel in Australia",2006,1,3,"0.99",48,"20.99","PG","2013-05-26 14:50:58.951","{""Deleted Scenes""}","'australia':18 'challeng':14 'dentist':11 'display':5 'emot':4 'goodfella':2 'man':8 'must':13 'rush':1 'squirrel':16"
509,"Language Cowboy","A Epic Yarn of a Cat And a Madman who must Vanquish a Dentist in An Abandoned Amusement Park",2006,1,5,"0.99",78,"26.99","NC-17","2013-05-26 14:50:58.951","{Trailers,""Deleted Scenes""}","'abandon':19 'amus':20 'cat':8 'cowboy':2 'dentist':16 'epic':4 'languag':1 'madman':11 'must':13 'park':21 'vanquish':14 'yarn':5"
510,"Lawless Vision","A Insightful Yarn of a Boy And a Sumo Wrestler who must Outgun a Car in The Outback",2006,1,6,"4.99",181,"29.99","G","2013-05-26 14:50:58.951","{""Deleted Scenes"",""Behind the Scenes""}","'boy':8 'car':17 'insight':4 'lawless':1 'must':14 'outback':20 'outgun':15 'sumo':11 'vision':2 'wrestler':12 'yarn':5"
511,"Lawrence Love","A Fanciful Yarn of a Database Administrator And a Mad Cow who must Pursue a Womanizer in Berlin",2006,1,7,"0.99",175,"23.99","NC-17","2013-05-26 14:50:58.951","{Commentaries,""Deleted Scenes"",""Behind the Scenes""}","'administr':9 'berlin':20 'cow':13 'databas':8 'fanci':4 'lawrenc':1 'love':2 'mad':12 'must':15 'pursu':16 'woman':18 'yarn':5"
512,"League Hellfighters","A Thoughtful Saga of a A Shark And a Monkey who must Outgun a Student in Ancient China",2006,1,5,"4.99",110,"25.99","PG-13","2013-05-26 14:50:58.951","{Trailers}","'ancient':19 'china':20 'hellfight':2 'leagu':1 'monkey':12 'must':14 'outgun':15 'saga':5 'shark':9 'student':17 'thought':4"
513,"Leathernecks Dwarfs","A Fateful Reflection of a Dog And a Mad Cow who must Outrace a Teacher in An Abandoned Mine Shaft",2006,1,6,"2.99",153,"21.99","PG-13","2013-05-26 14:50:58.951","{Trailers,Commentaries,""Behind the Scenes""}","'abandon':20 'cow':12 'dog':8 'dwarf':2 'fate':4 'leatherneck':1 'mad':11 'mine':21 'must':14 'outrac':15 'reflect':5 'shaft':22 'teacher':17"
517,"Lesson Cleopatra","A Emotional Display of a Man And a Explorer who must Build a Boy in A Manhattan Penthouse",2006,1,3,"0.99",167,"28.99","NC-17","2013-05-26 14:50:58.951","{""Deleted Scenes"",""Behind the Scenes""}","'boy':16 'build':14 'cleopatra':2 'display':5 'emot':4 'explor':11 'lesson':1 'man':8 'manhattan':19 'must':13 'penthous':20"
519,"Liberty Magnificent","A Boring Drama of a Student And a Cat who must Sink a Technical Writer in A Baloon",2006,1,3,"2.99",138,"27.99","G","2013-05-26 14:50:58.951","{Commentaries,""Deleted Scenes"",""Behind the Scenes""}","'baloon':20 'bore':4 'cat':11 'drama':5 'liberti':1 'magnific':2 'must':13 'sink':14 'student':8 'technic':16 'writer':17"
520,"License Weekend","A Insightful Story of a Man And a Husband who must Overcome a Madman in A Monastery",2006,1,7,"2.99",91,"28.99","NC-17","2013-05-26 14:50:58.951","{""Deleted Scenes"",""Behind the Scenes""}","'husband':11 'insight':4 'licens':1 'madman':16 'man':8 'monasteri':19 'must':13 'overcom':14 'stori':5 'weekend':2"
521,"Lies Treatment","A Fast-Paced Character Study of a Dentist And a Moose who must Defeat a Composer in The First Manned Space Station",2006,1,7,"4.99",147,"28.99","NC-17","2013-05-26 14:50:58.951","{Commentaries,""Deleted Scenes"",""Behind the Scenes""}","'charact':7 'compos':19 'defeat':17 'dentist':11 'fast':5 'fast-pac':4 'first':22 'lie':1 'man':23 'moos':14 'must':16 'pace':6 'space':24 'station':25 'studi':8 'treatment':2"
523,"Lights Deer","A Unbelieveable Epistle of a Dog And a Woman who must Confront a Moose in The Gulf of Mexico",2006,1,7,"0.99",174,"21.99","R","2013-05-26 14:50:58.951","{Commentaries}","'confront':14 'deer':2 'dog':8 'epistl':5 'gulf':19 'light':1 'mexico':21 'moos':16 'must':13 'unbeliev':4 'woman':11"
560,"Mars Roman","A Boring Drama of a Car And a Dog who must Succumb a Madman in Soviet Georgia",2006,1,6,"0.99",62,"21.99","NC-17","2013-05-26 14:50:58.951","{Commentaries,""Deleted Scenes""}","'bore':4 'car':8 'dog':11 'drama':5 'georgia':19 'madman':16 'mar':1 'must':13 'roman':2 'soviet':18 'succumb':14"
525,"Loathing Legally","A Boring Epistle of a Pioneer And a Mad Scientist who must Escape a Frisbee in The Gulf of Mexico",2006,1,4,"0.99",140,"29.99","R","2013-05-26 14:50:58.951","{""Deleted Scenes""}","'bore':4 'epistl':5 'escap':15 'frisbe':17 'gulf':20 'legal':2 'loath':1 'mad':11 'mexico':22 'must':14 'pioneer':8 'scientist':12"
527,"Lola Agent","A Astounding Tale of a Mad Scientist And a Husband who must Redeem a Database Administrator in Ancient Japan",2006,1,4,"4.99",85,"24.99","PG","2013-05-26 14:50:58.951","{Trailers,Commentaries}","'administr':18 'agent':2 'ancient':20 'astound':4 'databas':17 'husband':12 'japan':21 'lola':1 'mad':8 'must':14 'redeem':15 'scientist':9 'tale':5"
528,"Lolita World","A Thrilling Drama of a Girl And a Robot who must Redeem a Waitress in An Abandoned Mine Shaft",2006,1,4,"2.99",155,"25.99","NC-17","2013-05-26 14:50:58.951","{Trailers,""Deleted Scenes""}","'abandon':19 'drama':5 'girl':8 'lolita':1 'mine':20 'must':13 'redeem':14 'robot':11 'shaft':21 'thrill':4 'waitress':16 'world':2"
530,"Lord Arizona","A Action-Packed Display of a Frisbee And a Pastry Chef who must Pursue a Crocodile in A Jet Boat",2006,1,5,"2.99",108,"27.99","PG-13","2013-05-26 14:50:58.951","{Trailers}","'action':5 'action-pack':4 'arizona':2 'boat':23 'chef':14 'crocodil':19 'display':7 'frisbe':10 'jet':22 'lord':1 'must':16 'pack':6 'pastri':13 'pursu':17"
532,"Loser Hustler","A Stunning Drama of a Robot And a Feminist who must Outgun a Butler in Nigeria",2006,1,5,"4.99",80,"28.99","PG","2013-05-26 14:50:58.951","{""Deleted Scenes"",""Behind the Scenes""}","'butler':16 'drama':5 'feminist':11 'hustler':2 'loser':1 'must':13 'nigeria':18 'outgun':14 'robot':8 'stun':4"
533,"Lost Bird","A Emotional Character Study of a Robot And a A Shark who must Defeat a Technical Writer in A Manhattan Penthouse",2006,1,4,"2.99",98,"21.99","PG-13","2013-05-26 14:50:58.951","{""Deleted Scenes""}","'bird':2 'charact':5 'defeat':16 'emot':4 'lost':1 'manhattan':22 'must':15 'penthous':23 'robot':9 'shark':13 'studi':6 'technic':18 'writer':19"
535,"Love Suicides","A Brilliant Panorama of a Hunter And a Explorer who must Pursue a Dentist in An Abandoned Fun House",2006,1,6,"0.99",181,"21.99","R","2013-05-26 14:50:58.951","{Trailers,""Behind the Scenes""}","'abandon':19 'brilliant':4 'dentist':16 'explor':11 'fun':20 'hous':21 'hunter':8 'love':1 'must':13 'panorama':5 'pursu':14 'suicid':2"
537,"Lover Truman","A Emotional Yarn of a Robot And a Boy who must Outgun a Technical Writer in A U-Boat",2006,1,3,"2.99",75,"29.99","G","2013-05-26 14:50:58.951","{Trailers}","'boat':22 'boy':11 'emot':4 'lover':1 'must':13 'outgun':14 'robot':8 'technic':16 'truman':2 'u':21 'u-boat':20 'writer':17 'yarn':5"
539,"Luck Opus","A Boring Display of a Moose And a Squirrel who must Outrace a Teacher in A Shark Tank",2006,1,7,"2.99",152,"21.99","NC-17","2013-05-26 14:50:58.951","{Trailers,Commentaries,""Behind the Scenes""}","'bore':4 'display':5 'luck':1 'moos':8 'must':13 'opus':2 'outrac':14 'shark':19 'squirrel':11 'tank':20 'teacher':16"
541,"Luke Mummy","A Taut Character Study of a Boy And a Robot who must Redeem a Mad Scientist in Ancient India",2006,1,5,"2.99",74,"21.99","NC-17","2013-05-26 14:50:58.951","{Trailers,""Behind the Scenes""}","'ancient':20 'boy':9 'charact':5 'india':21 'luke':1 'mad':17 'mummi':2 'must':14 'redeem':15 'robot':12 'scientist':18 'studi':6 'taut':4"
561,"Mask Peach","A Boring Character Study of a Student And a Robot who must Meet a Woman in California",2006,1,6,"2.99",123,"26.99","NC-17","2013-05-26 14:50:58.951","{Commentaries,""Deleted Scenes""}","'bore':4 'california':19 'charact':5 'mask':1 'meet':15 'must':14 'peach':2 'robot':12 'student':9 'studi':6 'woman':17"
542,"Lust Lock","A Fanciful Panorama of a Hunter And a Dentist who must Meet a Secret Agent in The Sahara Desert",2006,1,3,"2.99",52,"28.99","G","2013-05-26 14:50:58.951","{Trailers,Commentaries,""Behind the Scenes""}","'agent':17 'dentist':11 'desert':21 'fanci':4 'hunter':8 'lock':2 'lust':1 'meet':14 'must':13 'panorama':5 'sahara':20 'secret':16"
543,"Madigan Dorado","A Astounding Character Study of a A Shark And a A Shark who must Discover a Crocodile in The Outback",2006,1,5,"4.99",116,"20.99","R","2013-05-26 14:50:58.951","{""Deleted Scenes"",""Behind the Scenes""}","'astound':4 'charact':5 'crocodil':19 'discov':17 'dorado':2 'madigan':1 'must':16 'outback':22 'shark':10,14 'studi':6"
546,"Madre Gables","A Intrepid Panorama of a Sumo Wrestler And a Forensic Psychologist who must Discover a Moose in The First Manned Space Station",2006,1,7,"2.99",98,"27.99","PG-13","2013-05-26 14:50:58.951","{Trailers,Commentaries,""Deleted Scenes""}","'discov':16 'first':21 'forens':12 'gabl':2 'intrepid':4 'madr':1 'man':22 'moos':18 'must':15 'panorama':5 'psychologist':13 'space':23 'station':24 'sumo':8 'wrestler':9"
548,"Magnificent Chitty","A Insightful Story of a Teacher And a Hunter who must Face a Mad Cow in California",2006,1,3,"2.99",53,"27.99","R","2013-05-26 14:50:58.951","{Commentaries,""Deleted Scenes""}","'california':19 'chitti':2 'cow':17 'face':14 'hunter':11 'insight':4 'mad':16 'magnific':1 'must':13 'stori':5 'teacher':8"
549,"Magnolia Forrester","A Thoughtful Documentary of a Composer And a Explorer who must Conquer a Dentist in New Orleans",2006,1,4,"0.99",171,"28.99","PG-13","2013-05-26 14:50:58.951","{Trailers,Commentaries,""Deleted Scenes""}","'compos':8 'conquer':14 'dentist':16 'documentari':5 'explor':11 'forrest':2 'magnolia':1 'must':13 'new':18 'orlean':19 'thought':4"
550,"Maguire Apache","A Fast-Paced Reflection of a Waitress And a Hunter who must Defeat a Forensic Psychologist in A Baloon",2006,1,6,"2.99",74,"22.99","NC-17","2013-05-26 14:50:58.951","{Trailers,Commentaries}","'apach':2 'baloon':22 'defeat':16 'fast':5 'fast-pac':4 'forens':18 'hunter':13 'maguir':1 'must':15 'pace':6 'psychologist':19 'reflect':7 'waitress':10"
554,"Malkovich Pet","A Intrepid Reflection of a Waitress And a A Shark who must Kill a Squirrel in The Outback",2006,1,6,"2.99",159,"22.99","G","2013-05-26 14:50:58.951","{""Behind the Scenes""}","'intrepid':4 'kill':15 'malkovich':1 'must':14 'outback':20 'pet':2 'reflect':5 'shark':12 'squirrel':17 'waitress':8"
555,"Mallrats United","A Thrilling Yarn of a Waitress And a Dentist who must Find a Hunter in A Monastery",2006,1,4,"0.99",133,"25.99","PG","2013-05-26 14:50:58.951","{Trailers,Commentaries,""Deleted Scenes""}","'dentist':11 'find':14 'hunter':16 'mallrat':1 'monasteri':19 'must':13 'thrill':4 'unit':2 'waitress':8 'yarn':5"
