"film_id","title","description","release_year","language_id","rental_duration","rental_rate","length","replacement_cost","rating","last_update","special_features","fulltext"
1,"Academy Dinosaur","A Epic Drama of a Feminist And a Mad Scientist who must Battle a Teacher in The Canadian Rockies",2006,1,6,"0.99",86,"20.99","PG","2013-05-26 14:50:58.951","{""Deleted Scenes"",""Behind the Scenes""}","'academi':1 'battl':15 'canadian':20 'dinosaur':2 'drama':5 'epic':4 'feminist':8 'mad':11 'must':14 'rocki':21 'scientist':12 'teacher':17"
4,"Affair Prejudice","A Fanciful Documentary of a Frisbee And a Lumberjack who must Chase a Monkey in A Shark Tank",2006,1,5,"2.99",117,"26.99","G","2013-05-26 14:50:58.951","{Commentaries,""Behind the Scenes""}","'affair':1 'chase':14 'documentari':5 'fanci':4 'frisbe':8 'lumberjack':11 'monkey':16 'must':13 'prejudic':2 'shark':19 'tank':20"
5,"African Egg","A Fast-Paced Documentary of a Pastry Chef And a Dentist who must Pursue a Forensic Psychologist in The Gulf of Mexico",2006,1,6,"2.99",130,"22.99","G","2013-05-26 14:50:58.951","{""Deleted Scenes""}","'african':1 'chef':11 'dentist':14 'documentari':7 'egg':2 'fast':5 'fast-pac':4 'forens':19 'gulf':23 'mexico':25 'must':16 'pace':6 'pastri':10 'psychologist':20 'pursu':17"
7,"Airplane Sierra","A Touching Saga of a Hunter And a Butler who must Discover a Butler in A Jet Boat",2006,1,6,"4.99",62,"28.99","PG-13","2013-05-26 14:50:58.951","{Trailers,""Deleted Scenes""}","'airplan':1 'boat':20 'butler':11,16 'discov':14 'hunter':8 'jet':19 'must':13 'saga':5 'sierra':2 'touch':4"
9,"Alabama Devil","A Thoughtful Panorama of a Database Administrator And a Mad Scientist who must Outgun a Mad Scientist in A Jet Boat",2006,1,3,"2.99",114,"21.99","PG-13","2013-05-26 14:50:58.951","{Trailers,""Deleted Scenes""}","'administr':9 'alabama':1 'boat':23 'databas':8 'devil':2 'jet':22 'mad':12,18 'must':15 'outgun':16 'panorama':5 'scientist':13,19 'thought':4"
10,"Aladdin Calendar","A Action-Packed Tale of a Man And a Lumberjack who must Reach a Feminist in Ancient China",2006,1,6,"4.99",63,"24.99","NC-17","2013-05-26 14:50:58.951","{Trailers,""Deleted Scenes""}","'action':5 'action-pack':4 'aladdin':1 'ancient':20 'calendar':2 'china':21 'feminist':18 'lumberjack':13 'man':10 'must':15 'pack':6 'reach':16 'tale':7"
12,"Alaska Phantom","A Fanciful Saga of a Hunter And a Pastry Chef who must Vanquish a Boy in Australia",2006,1,6,"0.99",136,"22.99","PG","2013-05-26 14:50:58.951","{Commentaries,""Deleted Scenes""}","'alaska':1 'australia':19 'boy':17 'chef':12 'fanci':4 'hunter':8 'must':14 'pastri':11 'phantom':2 'saga':5 'vanquish':15"
13,"Ali Forever","A Action-Packed Drama of a Dentist And a Crocodile who must Battle a Feminist in The Canadian Rockies",2006,1,4,"4.99",150,"21.99","PG","2013-05-26 14:50:58.951","{""Deleted Scenes"",""Behind the Scenes""}","'action':5 'action-pack':4 'ali':1 'battl':16 'canadian':21 'crocodil':13 'dentist':10 'drama':7 'feminist':18 'forev':2 'must':15 'pack':6 'rocki':22"
14,"Alice Fantasia","A Emotional Drama of a A Shark And a Database Administrator who must Vanquish a Pioneer in Soviet Georgia",2006,1,6,"0.99",94,"23.99","NC-17","2013-05-26 14:50:58.951","{Trailers,""Deleted Scenes"",""Behind the Scenes""}","'administr':13 'alic':1 'databas':12 'drama':5 'emot':4 'fantasia':2 'georgia':21 'must':15 'pioneer':18 'shark':9 'soviet':20 'vanquish':16"
16,"Alley Evolution","A Fast-Paced Drama of a Robot And a Composer who must Battle a Astronaut in New Orleans",2006,1,6,"2.99",180,"23.99","NC-17","2013-05-26 14:50:58.951","{Trailers,Commentaries}","'alley':1 'astronaut':18 'battl':16 'compos':13 'drama':7 'evolut':2 'fast':5 'fast-pac':4 'must':15 'new':20 'orlean':21 'pace':6 'robot':10"
18,"Alter Victory","A Thoughtful Drama of a Composer And a Feminist who must Meet a Secret Agent in The Canadian Rockies",2006,1,6,"0.99",57,"27.99","PG-13","2013-05-26 14:50:58.951","{Trailers,""Behind the Scenes""}","'agent':17 'alter':1 'canadian':20 'compos':8 'drama':5 'feminist':11 'meet':14 'must':13 'rocki':21 'secret':16 'thought':4 'victori':2"
19,"Amadeus Holy","A Emotional Display of a Pioneer And a Technical Writer who must Battle a Man in A Baloon",2006,1,6,"0.99",113,"20.99","PG","2013-05-26 14:50:58.951","{Commentaries,""Deleted Scenes"",""Behind the Scenes""}","'amadeus':1 'baloon':20 'battl':15 'display':5 'emot':4 'holi':2 'man':17 'must':14 'pioneer':8 'technic':11 'writer':12"
20,"Amelie Hellfighters","A Boring Drama of a Woman And a Squirrel who must Conquer a Student in A Baloon",2006,1,4,"4.99",79,"23.99","R","2013-05-26 14:50:58.951","{Commentaries,""Deleted Scenes"",""Behind the Scenes""}","'ameli':1 'baloon':19 'bore':4 'conquer':14 'drama':5 'hellfight':2 'must':13 'squirrel':11 'student':16 'woman':8"
30,"Anything Savannah","A Epic Story of a Pastry Chef And a Woman who must Chase a Feminist in An Abandoned Fun House",2006,1,4,"2.99",82,"27.99","R","2013-05-26 14:50:58.951","{Trailers,""Deleted Scenes"",""Behind the Scenes""}","'abandon':20 'anyth':1 'chase':15 'chef':9 'epic':4 'feminist':17 'fun':21 'hous':22 'must':14 'pastri':8 'savannah':2 'stori':5 'woman':12"
34,"Arabia Dogma","A Touching Epistle of a Madman And a Mad Cow who must Defeat a Student in Nigeria",2006,1,6,"0.99",62,"29.99","NC-17","2013-05-26 14:50:58.951","{Commentaries,""Deleted Scenes""}","'arabia':1 'cow':12 'defeat':15 'dogma':2 'epistl':5 'mad':11 'madman':8 'must':14 'nigeria':19 'student':17 'touch':4"
35,"Arachnophobia Rollercoaster","A Action-Packed Reflection of a Pastry Chef And a Composer who must Discover a Mad Scientist in The First Manned Space Station",2006,1,4,"2.99",147,"24.99","PG-13","2013-05-26 14:50:58.951","{Trailers,""Deleted Scenes"",""Behind the Scenes""}","'action':5 'action-pack':4 'arachnophobia':1 'chef':11 'compos':14 'discov':17 'first':23 'mad':19 'man':24 'must':16 'pack':6 'pastri':10 'reflect':7 'rollercoast':2 'scientist':20 'space':25 'station':26"
37,"Arizona Bang","A Brilliant Panorama of a Mad Scientist And a Mad Cow who must Meet a Pioneer in A Monastery",2006,1,3,"2.99",121,"28.99","PG","2013-05-26 14:50:58.951","{Trailers,""Deleted Scenes""}","'arizona':1 'bang':2 'brilliant':4 'cow':13 'mad':8,12 'meet':16 'monasteri':21 'must':15 'panorama':5 'pioneer':18 'scientist':9"
38,"Ark Ridgemont","A Beautiful Yarn of a Pioneer And a Monkey who must Pursue a Explorer in The Sahara Desert",2006,1,6,"0.99",68,"25.99","NC-17","2013-05-26 14:50:58.951","{Trailers,Commentaries,""Deleted Scenes"",""Behind the Scenes""}","'ark':1 'beauti':4 'desert':20 'explor':16 'monkey':11 'must':13 'pioneer':8 'pursu':14 'ridgemont':2 'sahara':19 'yarn':5"
40,"Army Flintstones","A Boring Saga of a Database Administrator And a Womanizer who must Battle a Waitress in Nigeria",2006,1,4,"0.99",148,"22.99","R","2013-05-26 14:50:58.951","{Trailers,Commentaries}","'administr':9 'armi':1 'battl':15 'bore':4 'databas':8 'flintston':2 'must':14 'nigeria':19 'saga':5 'waitress':17 'woman':12"
265,"Dying Maker","A Intrepid Tale of a Boat And a Monkey who must Kill a Cat in California",2006,1,5,"4.99",168,"28.99","PG","2013-05-26 14:50:58.951","{""Behind the Scenes""}","'boat':8 'california':18 'cat':16 'die':1 'intrepid':4 'kill':14 'maker':2 'monkey':11 'must':13 'tale':5"
44,"Attacks Hate","A Fast-Paced Panorama of a Technical Writer And a Mad Scientist who must Find a Feminist in An Abandoned Mine Shaft",2006,1,5,"4.99",113,"21.99","PG-13","2013-05-26 14:50:58.951","{Trailers,""Behind the Scenes""}","'abandon':23 'attack':1 'fast':5 'fast-pac':4 'feminist':20 'find':18 'hate':2 'mad':14 'mine':24 'must':17 'pace':6 'panorama':7 'scientist':15 'shaft':25 'technic':10 'writer':11"
47,"Baby Hall","A Boring Character Study of a A Shark And a Girl who must Outrace a Feminist in An Abandoned Mine Shaft",2006,1,5,"4.99",153,"23.99","NC-17","2013-05-26 14:50:58.951","{Commentaries}","'abandon':21 'babi':1 'bore':4 'charact':5 'feminist':18 'girl':13 'hall':2 'mine':22 'must':15 'outrac':16 'shaft':23 'shark':10 'studi':6"
48,"Backlash Undefeated","A Stunning Character Study of a Mad Scientist And a Mad Cow who must Kill a Car in A Monastery",2006,1,3,"4.99",118,"24.99","PG-13","2013-05-26 14:50:58.951","{Trailers,""Behind the Scenes""}","'backlash':1 'car':19 'charact':5 'cow':14 'kill':17 'mad':9,13 'monasteri':22 'must':16 'scientist':10 'studi':6 'stun':4 'undef':2"
49,"Badman Dawn","A Emotional Panorama of a Pioneer And a Composer who must Escape a Mad Scientist in A Jet Boat",2006,1,6,"2.99",162,"22.99","R","2013-05-26 14:50:58.951","{Trailers,Commentaries,""Behind the Scenes""}","'badman':1 'boat':21 'compos':11 'dawn':2 'emot':4 'escap':14 'jet':20 'mad':16 'must':13 'panorama':5 'pioneer':8 'scientist':17"
50,"Baked Cleopatra","A Stunning Drama of a Forensic Psychologist And a Husband who must Overcome a Waitress in A Monastery",2006,1,3,"2.99",182,"20.99","G","2013-05-26 14:50:58.951","{Commentaries,""Behind the Scenes""}","'bake':1 'cleopatra':2 'drama':5 'forens':8 'husband':12 'monasteri':20 'must':14 'overcom':15 'psychologist':9 'stun':4 'waitress':17"
52,"Ballroom Mockingbird","A Thrilling Documentary of a Composer And a Monkey who must Find a Feminist in California",2006,1,6,"0.99",173,"29.99","G","2013-05-26 14:50:58.951","{Commentaries,""Deleted Scenes""}","'ballroom':1 'california':18 'compos':8 'documentari':5 'feminist':16 'find':14 'mockingbird':2 'monkey':11 'must':13 'thrill':4"
53,"Bang Kwai","A Epic Drama of a Madman And a Cat who must Face a A Shark in An Abandoned Amusement Park",2006,1,5,"2.99",87,"25.99","NC-17","2013-05-26 14:50:58.951","{Commentaries,""Deleted Scenes"",""Behind the Scenes""}","'abandon':20 'amus':21 'bang':1 'cat':11 'drama':5 'epic':4 'face':14 'kwai':2 'madman':8 'must':13 'park':22 'shark':17"
55,"Barbarella Streetcar","A Awe-Inspiring Story of a Feminist And a Cat who must Conquer a Dog in A Monastery",2006,1,6,"2.99",65,"27.99","G","2013-05-26 14:50:58.951","{""Behind the Scenes""}","'awe':5 'awe-inspir':4 'barbarella':1 'cat':13 'conquer':16 'dog':18 'feminist':10 'inspir':6 'monasteri':21 'must':15 'stori':7 'streetcar':2"
59,"Bear Graceland","A Astounding Saga of a Dog And a Boy who must Kill a Teacher in The First Manned Space Station",2006,1,4,"2.99",160,"20.99","R","2013-05-26 14:50:58.951","{""Deleted Scenes""}","'astound':4 'bear':1 'boy':11 'dog':8 'first':19 'graceland':2 'kill':14 'man':20 'must':13 'saga':5 'space':21 'station':22 'teacher':16"
60,"Beast Hunchback","A Awe-Inspiring Epistle of a Student And a Squirrel who must Defeat a Boy in Ancient China",2006,1,3,"4.99",89,"22.99","R","2013-05-26 14:50:58.951","{""Deleted Scenes"",""Behind the Scenes""}","'ancient':20 'awe':5 'awe-inspir':4 'beast':1 'boy':18 'china':21 'defeat':16 'epistl':7 'hunchback':2 'inspir':6 'must':15 'squirrel':13 'student':10"
61,"Beauty Grease","A Fast-Paced Display of a Composer And a Moose who must Sink a Robot in An Abandoned Mine Shaft",2006,1,5,"4.99",175,"28.99","G","2013-05-26 14:50:58.951","{Trailers,Commentaries}","'abandon':21 'beauti':1 'compos':10 'display':7 'fast':5 'fast-pac':4 'greas':2 'mine':22 'moos':13 'must':15 'pace':6 'robot':18 'shaft':23 'sink':16"
62,"Bed Highball","A Astounding Panorama of a Lumberjack And a Dog who must Redeem a Woman in An Abandoned Fun House",2006,1,5,"2.99",106,"23.99","NC-17","2013-05-26 14:50:58.951","{Trailers,Commentaries,""Deleted Scenes""}","'abandon':19 'astound':4 'bed':1 'dog':11 'fun':20 'highbal':2 'hous':21 'lumberjack':8 'must':13 'panorama':5 'redeem':14 'woman':16"
63,"Bedazzled Married","A Astounding Character Study of a Madman And a Robot who must Meet a Mad Scientist in An Abandoned Fun House",2006,1,6,"0.99",73,"21.99","PG","2013-05-26 14:50:58.951","{Trailers,""Deleted Scenes"",""Behind the Scenes""}","'abandon':21 'astound':4 'bedazzl':1 'charact':5 'fun':22 'hous':23 'mad':17 'madman':9 'marri':2 'meet':15 'must':14 'robot':12 'scientist':18 'studi':6"
64,"Beethoven Exorcist","A Epic Display of a Pioneer And a Student who must Challenge a Butler in The Gulf of Mexico",2006,1,6,"0.99",151,"26.99","PG-13","2013-05-26 14:50:58.951","{Commentaries,""Behind the Scenes""}","'beethoven':1 'butler':16 'challeng':14 'display':5 'epic':4 'exorcist':2 'gulf':19 'mexico':21 'must':13 'pioneer':8 'student':11"
65,"Behavior Runaway","A Unbelieveable Drama of a Student And a Husband who must Outrace a Sumo Wrestler in Berlin",2006,1,3,"4.99",100,"20.99","PG","2013-05-26 14:50:58.951","{Trailers,""Deleted Scenes"",""Behind the Scenes""}","'behavior':1 'berlin':19 'drama':5 'husband':11 'must':13 'outrac':14 'runaway':2 'student':8 'sumo':16 'unbeliev':4 'wrestler':17"
66,"Beneath Rush","A Astounding Panorama of a Man And a Monkey who must Discover a Man in The First Manned Space Station",2006,1,6,"0.99",53,"27.99","NC-17","2013-05-26 14:50:58.951","{Commentaries,""Deleted Scenes""}","'astound':4 'beneath':1 'discov':14 'first':19 'man':8,16,20 'monkey':11 'must':13 'panorama':5 'rush':2 'space':21 'station':22"
67,"Berets Agent","A Taut Saga of a Crocodile And a Boy who must Overcome a Technical Writer in Ancient China",2006,1,5,"2.99",77,"24.99","PG-13","2013-05-26 14:50:58.951","{""Deleted Scenes""}","'agent':2 'ancient':19 'beret':1 'boy':11 'china':20 'crocodil':8 'must':13 'overcom':14 'saga':5 'taut':4 'technic':16 'writer':17"
68,"Betrayed Rear","A Emotional Character Study of a Boat And a Pioneer who must Find a Explorer in A Shark Tank",2006,1,5,"4.99",122,"26.99","NC-17","2013-05-26 14:50:58.951","{Commentaries,""Deleted Scenes"",""Behind the Scenes""}","'betray':1 'boat':9 'charact':5 'emot':4 'explor':17 'find':15 'must':14 'pioneer':12 'rear':2 'shark':20 'studi':6 'tank':21"
69,"Beverly Outlaw","A Fanciful Documentary of a Womanizer And a Boat who must Defeat a Madman in The First Manned Space Station",2006,1,3,"2.99",85,"21.99","R","2013-05-26 14:50:58.951","{Trailers}","'bever':1 'boat':11 'defeat':14 'documentari':5 'fanci':4 'first':19 'madman':16 'man':20 'must':13 'outlaw':2 'space':21 'station':22 'woman':8"
70,"Bikini Borrowers","A Astounding Drama of a Astronaut And a Cat who must Discover a Woman in The First Manned Space Station",2006,1,7,"4.99",142,"26.99","NC-17","2013-05-26 14:50:58.951","{Commentaries,""Deleted Scenes""}","'astound':4 'astronaut':8 'bikini':1 'borrow':2 'cat':11 'discov':14 'drama':5 'first':19 'man':20 'must':13 'space':21 'station':22 'woman':16"
71,"Bilko Anonymous","A Emotional Reflection of a Teacher And a Man who must Meet a Cat in The First Manned Space Station",2006,1,3,"4.99",100,"25.99","PG-13","2013-05-26 14:50:58.951","{Commentaries,""Deleted Scenes"",""Behind the Scenes""}","'anonym':2 'bilko':1 'cat':16 'emot':4 'first':19 'man':11,20 'meet':14 'must':13 'reflect':5 'space':21 'station':22 'teacher':8"
73,"Bingo Talented","A Touching Tale of a Girl And a Crocodile who must Discover a Waitress in Nigeria",2006,1,5,"2.99",150,"22.99","PG-13","2013-05-26 14:50:58.951","{Trailers,Commentaries}","'bingo':1 'crocodil':11 'discov':14 'girl':8 'must':13 'nigeria':18 'tale':5 'talent':2 'touch':4 'waitress':16"
76,"Birdcage Casper","A Fast-Paced Saga of a Frisbee And a Astronaut who must Overcome a Feminist in Ancient India",2006,1,4,"0.99",103,"23.99","NC-17","2013-05-26 14:50:58.951","{Commentaries,""Deleted Scenes"",""Behind the Scenes""}","'ancient':20 'astronaut':13 'birdcag':1 'casper':2 'fast':5 'fast-pac':4 'feminist':18 'frisbe':10 'india':21 'must':15 'overcom':16 'pace':6 'saga':7"
80,"Blanket Beverly","A Emotional Documentary of a Student And a Girl who must Build a Boat in Nigeria",2006,1,7,"2.99",148,"21.99","G","2013-05-26 14:50:58.951","{Trailers}","'bever':2 'blanket':1 'boat':16 'build':14 'documentari':5 'emot':4 'girl':11 'must':13 'nigeria':18 'student':8"
81,"Blindness Gun","A Touching Drama of a Robot And a Dentist who must Meet a Hunter in A Jet Boat",2006,1,6,"4.99",103,"29.99","PG-13","2013-05-26 14:50:58.951","{Trailers,""Behind the Scenes""}","'blind':1 'boat':20 'dentist':11 'drama':5 'gun':2 'hunter':16 'jet':19 'meet':14 'must':13 'robot':8 'touch':4"
85,"Bonnie Holocaust","A Fast-Paced Story of a Crocodile And a Robot who must Find a Moose in Ancient Japan",2006,1,4,"0.99",63,"29.99","G","2013-05-26 14:50:58.951","{""Deleted Scenes""}","'ancient':20 'bonni':1 'crocodil':10 'fast':5 'fast-pac':4 'find':16 'holocaust':2 'japan':21 'moos':18 'must':15 'pace':6 'robot':13 'stori':7"
89,"Borrowers Bedazzled","A Brilliant Epistle of a Teacher And a Sumo Wrestler who must Defeat a Man in An Abandoned Fun House",2006,1,7,"0.99",63,"22.99","G","2013-05-26 14:50:58.951","{Commentaries,""Deleted Scenes"",""Behind the Scenes""}","'abandon':20 'bedazzl':2 'borrow':1 'brilliant':4 'defeat':15 'epistl':5 'fun':21 'hous':22 'man':17 'must':14 'sumo':11 'teacher':8 'wrestler':12"
93,"Brannigan Sunrise","A Amazing Epistle of a Moose And a Crocodile who must Outrace a Dog in Berlin",2006,1,4,"4.99",121,"27.99","PG","2013-05-26 14:50:58.951","{Trailers}","'amaz':4 'berlin':18 'brannigan':1 'crocodil':11 'dog':16 'epistl':5 'moos':8 'must':13 'outrac':14 'sunris':2"
96,"Breaking Home","A Beautiful Display of a Secret Agent And a Monkey who must Battle a Sumo Wrestler in An Abandoned Mine Shaft",2006,1,4,"2.99",169,"21.99","PG-13","2013-05-26 14:50:58.951","{Trailers,Commentaries}","'abandon':21 'agent':9 'battl':15 'beauti':4 'break':1 'display':5 'home':2 'mine':22 'monkey':12 'must':14 'secret':8 'shaft':23 'sumo':17 'wrestler':18"
97,"Bride Intrigue","A Epic Tale of a Robot And a Monkey who must Vanquish a Man in New Orleans",2006,1,7,"0.99",56,"24.99","G","2013-05-26 14:50:58.951","{Trailers,Commentaries,""Behind the Scenes""}","'bride':1 'epic':4 'intrigu':2 'man':16 'monkey':11 'must':13 'new':18 'orlean':19 'robot':8 'tale':5 'vanquish':14"
100,"Brooklyn Desert","A Beautiful Drama of a Dentist And a Composer who must Battle a Sumo Wrestler in The First Manned Space Station",2006,1,7,"4.99",161,"21.99","R","2013-05-26 14:50:58.951","{Commentaries}","'battl':14 'beauti':4 'brooklyn':1 'compos':11 'dentist':8 'desert':2 'drama':5 'first':20 'man':21 'must':13 'space':22 'station':23 'sumo':16 'wrestler':17"
101,"Brotherhood Blanket","A Fateful Character Study of a Butler And a Technical Writer who must Sink a Astronaut in Ancient Japan",2006,1,3,"0.99",73,"26.99","R","2013-05-26 14:50:58.951","{""Behind the Scenes""}","'ancient':20 'astronaut':18 'blanket':2 'brotherhood':1 'butler':9 'charact':5 'fate':4 'japan':21 'must':15 'sink':16 'studi':6 'technic':12 'writer':13"
102,"Bubble Grosse","A Awe-Inspiring Panorama of a Crocodile And a Moose who must Confront a Girl in A Baloon",2006,1,4,"4.99",60,"20.99","R","2013-05-26 14:50:58.951","{Trailers,Commentaries,""Deleted Scenes"",""Behind the Scenes""}","'awe':5 'awe-inspir':4 'baloon':21 'bubbl':1 'confront':16 'crocodil':10 'girl':18 'gross':2 'inspir':6 'moos':13 'must':15 'panorama':7"
103,"Bucket Brotherhood","A Amazing Display of a Girl And a Womanizer who must Succumb a Lumberjack in A Baloon Factory",2006,1,7,"4.99",133,"27.99","PG","2013-05-26 14:50:58.951","{Commentaries,""Deleted Scenes""}","'amaz':4 'baloon':19 'brotherhood':2 'bucket':1 'display':5 'factori':20 'girl':8 'lumberjack':16 'must':13 'succumb':14 'woman':11"
105,"Bull Shawshank","A Fanciful Drama of a Moose And a Squirrel who must Conquer a Pioneer in The Canadian Rockies",2006,1,6,"0.99",125,"21.99","NC-17","2013-05-26 14:50:58.951","{""Deleted Scenes""}","'bull':1 'canadian':19 'conquer':14 'drama':5 'fanci':4 'moos':8 'must':13 'pioneer':16 'rocki':20 'shawshank':2 'squirrel':11"
110,"Cabin Flash","A Stunning Epistle of a Boat And a Man who must Challenge a A Shark in A Baloon Factory",2006,1,4,"0.99",53,"25.99","NC-17","2013-05-26 14:50:58.951","{Commentaries,""Deleted Scenes""}","'baloon':20 'boat':8 'cabin':1 'challeng':14 'epistl':5 'factori':21 'flash':2 'man':11 'must':13 'shark':17 'stun':4"
112,"Calendar Gunfight","A Thrilling Drama of a Frisbee And a Lumberjack who must Sink a Man in Nigeria",2006,1,4,"4.99",120,"22.99","NC-17","2013-05-26 14:50:58.951","{Trailers,Commentaries,""Behind the Scenes""}","'calendar':1 'drama':5 'frisbe':8 'gunfight':2 'lumberjack':11 'man':16 'must':13 'nigeria':18 'sink':14 'thrill':4"
114,"Camelot Vacation","A Touching Character Study of a Woman And a Waitress who must Battle a Pastry Chef in A MySQL Convention",2006,1,3,"0.99",61,"26.99","NC-17","2013-05-26 14:50:58.951","{Trailers,Commentaries,""Deleted Scenes"",""Behind the Scenes""}","'battl':15 'camelot':1 'charact':5 'chef':18 'convent':22 'must':14 'mysql':21 'pastri':17 'studi':6 'touch':4 'vacat':2 'waitress':12 'woman':9"
115,"Campus Remember","A Astounding Drama of a Crocodile And a Mad Cow who must Build a Robot in A Jet Boat",2006,1,5,"2.99",167,"27.99","R","2013-05-26 14:50:58.951","{""Behind the Scenes""}","'astound':4 'boat':21 'build':15 'campus':1 'cow':12 'crocodil':8 'drama':5 'jet':20 'mad':11 'must':14 'rememb':2 'robot':17"
118,"Canyon Stock","A Thoughtful Reflection of a Waitress And a Feminist who must Escape a Squirrel in A Manhattan Penthouse",2006,1,7,"0.99",85,"26.99","R","2013-05-26 14:50:58.951","{Trailers,""Deleted Scenes""}","'canyon':1 'escap':14 'feminist':11 'manhattan':19 'must':13 'penthous':20 'reflect':5 'squirrel':16 'stock':2 'thought':4 'waitress':8"
119,"Caper Motions","A Fateful Saga of a Moose And a Car who must Pursue a Woman in A MySQL Convention",2006,1,6,"0.99",176,"22.99","G","2013-05-26 14:50:58.951","{Trailers,Commentaries,""Deleted Scenes""}","'caper':1 'car':11 'convent':20 'fate':4 'moos':8 'motion':2 'must':13 'mysql':19 'pursu':14 'saga':5 'woman':16"
123,"Casablanca Super","A Amazing Panorama of a Crocodile And a Forensic Psychologist who must Pursue a Secret Agent in The First Manned Space Station",2006,1,6,"4.99",85,"22.99","G","2013-05-26 14:50:58.951","{Trailers,""Deleted Scenes"",""Behind the Scenes""}","'agent':18 'amaz':4 'casablanca':1 'crocodil':8 'first':21 'forens':11 'man':22 'must':14 'panorama':5 'psychologist':12 'pursu':15 'secret':17 'space':23 'station':24 'super':2"
130,"Celebrity Horn","A Amazing Documentary of a Secret Agent And a Astronaut who must Vanquish a Hunter in A Shark Tank",2006,1,7,"0.99",110,"24.99","PG-13","2013-05-26 14:50:58.951","{""Deleted Scenes"",""Behind the Scenes""}","'agent':9 'amaz':4 'astronaut':12 'celebr':1 'documentari':5 'horn':2 'hunter':17 'must':14 'secret':8 'shark':20 'tank':21 'vanquish':15"
132,"Chainsaw Uptown","A Beautiful Documentary of a Boy And a Robot who must Discover a Squirrel in Australia",2006,1,6,"0.99",114,"25.99","PG","2013-05-26 14:50:58.951","{""Deleted Scenes"",""Behind the Scenes""}","'australia':18 'beauti':4 'boy':8 'chainsaw':1 'discov':14 'documentari':5 'must':13 'robot':11 'squirrel':16 'uptown':2"
134,"Champion Flatliners","A Amazing Story of a Mad Cow And a Dog who must Kill a Husband in A Monastery",2006,1,4,"4.99",51,"21.99","PG","2013-05-26 14:50:58.951","{Trailers}","'amaz':4 'champion':1 'cow':9 'dog':12 'flatlin':2 'husband':17 'kill':15 'mad':8 'monasteri':20 'must':14 'stori':5"
135,"Chance Resurrection","A Astounding Story of a Forensic Psychologist And a Forensic Psychologist who must Overcome a Moose in Ancient China",2006,1,3,"2.99",70,"22.99","R","2013-05-26 14:50:58.951","{Commentaries,""Deleted Scenes"",""Behind the Scenes""}","'ancient':20 'astound':4 'chanc':1 'china':21 'forens':8,12 'moos':18 'must':15 'overcom':16 'psychologist':9,13 'resurrect':2 'stori':5"
136,"Chaplin License","A Boring Drama of a Dog And a Forensic Psychologist who must Outrace a Explorer in Ancient India",2006,1,7,"2.99",146,"26.99","NC-17","2013-05-26 14:50:58.951","{""Behind the Scenes""}","'ancient':19 'bore':4 'chaplin':1 'dog':8 'drama':5 'explor':17 'forens':11 'india':20 'licens':2 'must':14 'outrac':15 'psychologist':12"
137,"Charade Duffel","A Action-Packed Display of a Man And a Waitress who must Build a Dog in A MySQL Convention",2006,1,3,"2.99",66,"21.99","PG","2013-05-26 14:50:58.951","{Trailers,""Deleted Scenes"",""Behind the Scenes""}","'action':5 'action-pack':4 'build':16 'charad':1 'convent':22 'display':7 'dog':18 'duffel':2 'man':10 'must':15 'mysql':21 'pack':6 'waitress':13"
138,"Chariots Conspiracy","A Unbelieveable Epistle of a Robot And a Husband who must Chase a Robot in The First Manned Space Station",2006,1,5,"2.99",71,"29.99","R","2013-05-26 14:50:58.951","{""Deleted Scenes"",""Behind the Scenes""}","'chariot':1 'chase':14 'conspiraci':2 'epistl':5 'first':19 'husband':11 'man':20 'must':13 'robot':8,16 'space':21 'station':22 'unbeliev':4"
139,"Chasing Fight","A Astounding Saga of a Technical Writer And a Butler who must Battle a Butler in A Shark Tank",2006,1,7,"4.99",114,"21.99","PG","2013-05-26 14:50:58.951","{Trailers,Commentaries}","'astound':4 'battl':15 'butler':12,17 'chase':1 'fight':2 'must':14 'saga':5 'shark':20 'tank':21 'technic':8 'writer':9"
140,"Cheaper Clyde","A Emotional Character Study of a Pioneer And a Girl who must Discover a Dog in Ancient Japan",2006,1,6,"0.99",87,"23.99","G","2013-05-26 14:50:58.951","{Trailers,Commentaries,""Behind the Scenes""}","'ancient':19 'charact':5 'cheaper':1 'clyde':2 'discov':15 'dog':17 'emot':4 'girl':12 'japan':20 'must':14 'pioneer':9 'studi':6"
142,"Chicken Hellfighters","A Emotional Drama of a Dog And a Explorer who must Outrace a Technical Writer in Australia",2006,1,3,"0.99",122,"24.99","PG","2013-05-26 14:50:58.951","{Trailers,Commentaries,""Deleted Scenes"",""Behind the Scenes""}","'australia':19 'chicken':1 'dog':8 'drama':5 'emot':4 'explor':11 'hellfight':2 'must':13 'outrac':14 'technic':16 'writer':17"
